{"error":"the participant found no valid signature from the party's key","code":"LEDGER_SIGNATURE_REJECTED","status":422,"stage":"execute","hint":"sign the prepared transaction's hash with key relaytest::1220ebb7…4288 <not the base64 text> & retry","requestId":"req-01HZX","upstream":{"service":"canton","status":400,"code":"FAILED_TO_EXECUTE_TRANSACTION","grpcCode":"INVALID_ARGUMENT","traceId":"009fa53edf07ce7f","node":"app-provider"}}
