{"error":"the participant found no valid signature from the party's key","code":"LEDGER_SIGNATURE_REJECTED","status":422,"stage":"execute","hint":"sign the prepared transaction's hash with key relaytest::1220ebb7…4288 <not the base64 text> & retry","requestId":"req-01HZX","upstream":{"service":"canton","status":400,"code":"FAILED_TO_EXECUTE_TRANSACTION","grpcCode":"INVALID_ARGUMENT","cause":"Received 0 valid signatures. Transaction hash to be signed: 1220aa","traceId":"009fa53edf07ce7f","node":"app-provider"},"details":{"actAs":["relaytest::1220ebb7b95ec6e5cfa8dbf6aa11981e4e1645b1926e4a5afb2c46d7ef49f7ca4288"],"expectedHash":"1220aaaaaaaaaaaaaaaaaaaaaaaaaaaaaaaaaaaaaaaaaaaaaaaaaaaaaaaaaaaaaaaa","party":"relaytest::1220ebb7b95ec6e5cfa8dbf6aa11981e4e1645b1926e4a5afb2c46d7ef49f7ca4288","signatureReceived":"3f3f3f3f3f3f3f3f3f3f3f3f3f3f3f3f3f3f3f3f3f3f3f3f3f3f3f3f3f3f3f3f3f3f3f3f3f3f3f3f3f3f3f3f3f3f3f3f3f3f3f3f3f3f3f3f3f3f3f3f3f3f3f3f"}}
