{"error":"the ledger denied the submitting ledger user","code":"LEDGER_PERMISSION_DENIED","status":403,"stage":"execute","hint":"the ledger user needs the right this command requires (CanActAs, CanExecuteAs or CanReadAs) on the acting party","upstream":{"service":"canton","status":403,"code":"NA","grpcCode":"PERMISSION_DENIED","cause":"A security-sensitive error has been received","traceId":"201bbde391265d0060f31532d180aa7f","node":"app-provider"}}
