{"error":"the ledger rejected the submitting token","code":"LEDGER_UNAUTHENTICATED","status":502,"stage":"submit","hint":"ledger auth is misconfigured (token issuer, audience or secret) -- an operator problem, not the user's","upstream":{"service":"canton","status":401,"code":"NA","grpcCode":"UNAUTHENTICATED","cause":"A security-sensitive error has been received","traceId":"7a4","node":"bank"}}
