{"error":"the ledger couldn't find something the request needs","code":"LEDGER_NOT_FOUND","status":409,"stage":"submit","hint":"a referenced contract may already be archived (stale contract id) or not visible to the acting party -- refresh and retry","upstream":{"service":"canton","status":404,"code":"CONTRACT_NOT_FOUND","grpcCode":"NOT_FOUND","cause":"Contract could not be found with id 00abc","traceId":"7a1","node":"bank"}}
